{
  "$schema": "https://json-schema.org/draft/2020-12/schema",
  "$id": "https://promptbook.local/schema/submission.v1.json",
  "title": "Promptbook proposed contribution v1",
  "type": "object",
  "additionalProperties": false,
  "required": [
    "schemaVersion",
    "title",
    "promptText",
    "kind",
    "category",
    "generation",
    "mediaSources",
    "author",
    "sourceUrl",
    "rights"
  ],
  "properties": {
    "schemaVersion": {
      "const": 1
    },
    "title": {
      "type": "string",
      "minLength": 1,
      "maxLength": 100
    },
    "promptText": {
      "type": "string",
      "minLength": 1,
      "maxLength": 60000
    },
    "kind": {
      "enum": [
        "image",
        "video"
      ]
    },
    "category": {
      "type": "string",
      "pattern": "^[a-z0-9][a-z0-9-]{2,79}$"
    },
    "tags": {
      "type": "array",
      "maxItems": 8,
      "uniqueItems": true,
      "items": {
        "type": "string",
        "minLength": 1,
        "maxLength": 32
      }
    },
    "generation": {
      "type": "object",
      "additionalProperties": false,
      "required": [
        "platform",
        "modelLabel",
        "modelId",
        "modelEvidence",
        "generatedAt",
        "parameters"
      ],
      "properties": {
        "platform": {
          "type": "string",
          "maxLength": 100
        },
        "modelLabel": {
          "type": "string",
          "minLength": 1,
          "maxLength": 150
        },
        "modelId": {
          "type": [
            "string",
            "null"
          ],
          "maxLength": 300
        },
        "modelEvidence": {
          "enum": [
            "unknown",
            "user-reported",
            "platform-displayed",
            "api-returned"
          ]
        },
        "generatedAt": {
          "anyOf": [
            {
              "type": "string",
              "format": "date-time"
            },
            {
              "type": "null"
            }
          ]
        },
        "parameters": {
          "type": "object",
          "maxProperties": 40,
          "propertyNames": {
            "maxLength": 80
          },
          "additionalProperties": {
            "type": [
              "string",
              "number",
              "boolean",
              "null"
            ],
            "maxLength": 2000
          }
        }
      }
    },
    "mediaSources": {
      "type": "array",
      "minItems": 1,
      "maxItems": 8,
      "items": {
        "type": "object",
        "additionalProperties": false,
        "required": [
          "url",
          "description"
        ],
        "properties": {
          "url": {
            "type": "string",
            "format": "uri",
            "pattern": "^https://",
            "maxLength": 2000
          },
          "description": {
            "type": "string",
            "minLength": 1,
            "maxLength": 1000
          }
        }
      }
    },
    "author": {
      "type": "string",
      "minLength": 1,
      "maxLength": 120
    },
    "sourceUrl": {
      "anyOf": [
        {
          "type": "string",
          "format": "uri",
          "pattern": "^https://",
          "maxLength": 2000
        },
        {
          "type": "null"
        }
      ]
    },
    "rights": {
      "type": "object",
      "additionalProperties": false,
      "required": [
        "prompt",
        "media"
      ],
      "properties": {
        "prompt": {
          "enum": [
            "unspecified",
            "CC0-1.0",
            "CC-BY-4.0",
            "permission-granted",
            "all-rights-reserved"
          ]
        },
        "media": {
          "enum": [
            "unspecified",
            "CC0-1.0",
            "CC-BY-4.0",
            "permission-granted",
            "all-rights-reserved"
          ]
        },
        "notes": {
          "type": "string",
          "maxLength": 2000
        }
      }
    },
    "notes": {
      "type": "string",
      "maxLength": 12000
    }
  }
}
